{
  "$schema": "https://json-schema.org/draft/2020-12/schema",
  "description": "NightWatch graph snapshot",
  "type": "object",
  "required": ["schema_version", "seq", "at", "nodes", "edges", "sources", "gap_before"],
  "properties": {
    "schema_version": { "const": "nightwatch.snapshot.v2" },
    "seq": { "type": "integer" },
    "at": {
      "type": "string",
      "pattern": "^\\d{4}-\\d{2}-\\d{2}T\\d{2}:\\d{2}:\\d{2}(\\.\\d+)?Z$"
    },
    "t": { "type": "integer" },
    "nodes": {
      "type": "array",
      "items": { "$ref": "node.schema.json" }
    },
    "edges": {
      "type": "array",
      "items": { "$ref": "edge.schema.json" }
    },
    "sources": {
      "type": "object",
      "required": ["prometheus", "jaeger", "logstore"],
      "properties": {
        "prometheus": {
          "type": "object",
          "required": ["ok", "age_secs"],
          "properties": {
            "ok": { "type": "boolean" },
            "age_secs": { "type": "number" }
          },
          "additionalProperties": false
        },
        "jaeger": {
          "type": "object",
          "required": ["ok", "age_secs"],
          "properties": {
            "ok": { "type": "boolean" },
            "age_secs": { "type": "number" }
          },
          "additionalProperties": false
        },
        "logstore": {
          "type": "object",
          "required": ["ok", "age_secs"],
          "properties": {
            "ok": { "type": "boolean" },
            "age_secs": { "type": "number" }
          },
          "additionalProperties": false
        }
      },
      "additionalProperties": false
    },
    "gap_before": {
      "oneOf": [
        { "type": "null" },
        {
          "type": "object",
          "required": ["from", "to"],
          "properties": {
            "from": { "type": "string" },
            "to": { "type": "string" }
          },
          "additionalProperties": false
        }
      ]
    }
  },
  "additionalProperties": false
}
